[
  {
    "id": "AOF-SAMPLE-01",
    "domain": 2,
    "skill": "fact-checking",
    "difficulty": 2,
    "type": "single",
    "select": 1,
    "stem": "An associate asks Claude to summarize a new regulation, and Claude produces a confident summary citing a specific subsection number. Before sending the summary to the compliance team, what is the most appropriate action?",
    "options": [
      {
        "id": "A",
        "correct": false,
        "text": "Send it as-is, since Claude expressed high confidence.",
        "why": "Self-reported confidence is not a reliable accuracy signal; language models can fabricate specific-looking details such as citation numbers while sounding certain."
      },
      {
        "id": "B",
        "correct": true,
        "text": "Verify the cited subsection against the official regulation text before sharing.",
        "why": "Validating factual claims, especially citations bound for a compliance audience, against an authoritative source is the diligence step required."
      },
      {
        "id": "C",
        "correct": false,
        "text": "Ask Claude to rate its own confidence and send it if the rating is high.",
        "why": "A confidence rating from the model is still self-reported and does not check the citation against the real regulation."
      },
      {
        "id": "D",
        "correct": false,
        "text": "Reword the summary to sound more formal, then send it.",
        "why": "Reformatting changes the tone but does nothing to address whether the cited subsection is correct."
      }
    ],
    "explanation": "Language models can fabricate specific-looking details such as citation numbers, a hallucination. Validating factual claims, especially citations bound for a compliance audience, against an authoritative source is the diligence step required. Self-reported confidence is not a reliable accuracy signal, and reformatting does not address correctness.",
    "reference": "CCAO-F Exam Guide v1.0 — Sample 1 (Domain 2, Output Evaluation and Validation)",
    "source": "Official Exam Guide v1.0 sample 1"
  },
  {
    "id": "AOF-SAMPLE-02",
    "domain": 3,
    "skill": "model-fit",
    "difficulty": 2,
    "type": "single",
    "select": 1,
    "stem": "An associate needs to generate a high volume of short customer-reply drafts where speed and cost matter more than deep reasoning. Which choice best fits the task?",
    "options": [
      {
        "id": "A",
        "correct": false,
        "text": "Use the most capable, highest-cost model for every reply to maximize quality.",
        "why": "Always using the top model wastes the cost and latency budget on straightforward work that does not need deep reasoning."
      },
      {
        "id": "B",
        "correct": true,
        "text": "Use a faster, lower-cost model suited to straightforward, high-volume tasks.",
        "why": "Aligning model selection with task requirements means matching a faster, lower-cost model to straightforward, high-volume work, reserving the most capable model for complex reasoning."
      },
      {
        "id": "C",
        "correct": false,
        "text": "Disable all product features to reduce cost.",
        "why": "Turning off features does not address the speed-versus-quality trade-off in model selection and may remove capabilities the task needs."
      },
      {
        "id": "D",
        "correct": false,
        "text": "Switch to a different AI platform.",
        "why": "Changing platforms does not address the trade-off; the question is which Claude model fits the task's speed and cost requirements."
      }
    ],
    "explanation": "Aligning model selection with task requirements means matching a faster, lower-cost model to straightforward, high-volume work, reserving the most capable model for complex reasoning. Always using the top model wastes the cost and latency budget; disabling features or switching platforms does not address the trade-off.",
    "reference": "CCAO-F Exam Guide v1.0 — Sample 2 (Domain 3, Product and Model Selection)",
    "source": "Official Exam Guide v1.0 sample 2"
  },
  {
    "id": "AOF-SAMPLE-03",
    "domain": 6,
    "skill": "data-sensitivity",
    "difficulty": 2,
    "type": "single",
    "select": 1,
    "stem": "A project manager wants to upload a spreadsheet containing customer names and account numbers so Claude can analyze trends. Organizational policy restricts sharing regulated personal data. What is the most appropriate action?",
    "options": [
      {
        "id": "A",
        "correct": false,
        "text": "Upload the file as-is, since the analysis is internal.",
        "why": "Uploading regulated personal identifiers as-is violates the organizational policy regardless of the analysis being internal."
      },
      {
        "id": "B",
        "correct": true,
        "text": "Remove or anonymize the personal identifiers before uploading, consistent with policy.",
        "why": "Applying data-sensitivity and privacy safeguards means redacting or anonymizing regulated identifiers before use, so the analysis can proceed without exposing protected data."
      },
      {
        "id": "C",
        "correct": false,
        "text": "Upload the file but instruct Claude not to retain it.",
        "why": "Instructing the model not to retain data does not satisfy the policy control; the regulated data has still been shared."
      },
      {
        "id": "D",
        "correct": false,
        "text": "Skip the analysis entirely.",
        "why": "Abandoning the task is unnecessary when anonymization enables it to proceed within policy."
      }
    ],
    "explanation": "Applying data-sensitivity and privacy safeguards means redacting or anonymizing regulated identifiers before use, so the analysis can proceed without exposing protected data. Uploading as-is violates policy; instructing the model not to retain data does not satisfy the policy control; abandoning the task is unnecessary when anonymization enables it.",
    "reference": "CCAO-F Exam Guide v1.0 — Sample 3 (Domain 6, Governance, Risk, and Responsible Use)",
    "source": "Official Exam Guide v1.0 sample 3"
  }
]
